<?xml version="1.0" standalone="no"?><!-- edited with XML Spy v3.0.7 (http://www.xmlspy.com) by Rajgopal (ICPL) --><!DOCTYPE Legislation SYSTEM "../../dtd/Legislation.dtd" [<!ENTITY amp "&#38;#38;"><!ENTITY apos "&#39;">]><Legislation><Number>23</Number><Year>2019</Year><LegislativeBody>Central Legislature</LegislativeBody><Date>01/08/2019</Date><Title> Finance (No. 2) Act, 2019</Title><Preamble> An Act to give effect to the financial proposals of the Central Government for the financial year 2019-2020.
BE it enacted by Parliament in the Seventieth Year of the Republic of India as follows:-</Preamble>
<StatementofObject></StatementofObject><Chapters><Chapter><Number>CHAPTER I</Number><Name>PRELIMINARY</Name><Sections><Section><Number>1</Number><Heading>Short title, extent and commencement</Heading>(1) This Act may be called the Finance (No. 2) Act, 2019.<NewPara/>((2) Save as otherwise provided in this Act,-<NewPara/>
(a) sections 2 to 69 shall be deemed to have come into force on the 1st day of April, 2019;<NewPara/>
(b) sections 92 to 112 and section 114 shall come into force on such date as the Central Government may, by notification in the Official Gazette, appoint.<NewPara/></Section></Sections>
</Chapter>
<Chapter><Number>PART XIII</Number><Name>AMENDMENTS TO THE PREVENTION OF MONEY-LAUNDERING ACT, 2002</Name><Sections>
<Section><Number>2</Number><Heading> Amendment of section 3</Heading>"Explanation.-For the removal of doubts, it is hereby clarified that,-<NewPara/>
(i) a person shall be guilty of offence of money-laundering if such person is found to have directly or indirectly attempted to indulge or knowingly assisted or knowingly is a party or is actually involved in one or more of the following processes or activities connected with proceeds of crime, namely:-<NewPara/>
(a) concealment; or<NewPara/>
(b) possession; or<NewPara/>
(c) acquisition; or<NewPara/>
(d) use; or<NewPara/>
(e) projecting as untainted property; or<NewPara/>
(f) claiming as untainted property,<NewPara/>
in any manner whatsoever;<NewPara/>
(ii) the process or activity connected with proceeds of crime is a continuing activity and continues till such time a person is directly or indirectly enjoying the proceeds of crime by its concealment or possession or acquisition or use or projecting it as untainted property or claiming it as untainted property in any manner whatsoever.".
<NewPara/></Section></Sections></Chapter></Chapters><FootNotes/><EditorsNote/><Laws><Law>Banking &amp; Finance</Law><Law>RBI</Law></Laws><Industries/><States><State>Center</State></States></Legislation>