<?xml version="1.0" standalone="no"?><!-- edited with XML Spy v3.0.7 (http://www.xmlspy.com) by Rajgopal (ICPL) --><!DOCTYPE Legislation SYSTEM "../../dtd/Legislation.dtd" [<!ENTITY amp "&#38;#38;"><!ENTITY apos "&#39;">]><Legislation><Number>2</Number><Year>2013</Year><LegislativeBody>Central Legislature</LegislativeBody><Date>03/01/2013</Date><Title> Prevention of Money-laundering (Amendment) Act, 2012</Title><Preamble> An Act further to amend the Prevention of Money-laundering Act, 2002. Be it enacted by Parliament in the Sixty-third Year of the Republic of India as follows:-</Preamble>
<StatementofObject></StatementofObject><Chapters><Chapter><Number>CHAPTER I</Number><Name>PRELIMINARY</Name><Sections><Section><Number>1</Number><Heading>Short title, extent and commencement</Heading> (1) This Act may be called the Prevention of Money-laundering (Amendment) Act, 2012.<NewPara/>(2) It shall come into force on such date as the Central Government may, by notification in the Official Gazette, appoint and different dates may be appointed for different provisions of this Act.<NewPara/></Section>
<Section><Number>2</Number><Heading>Amendment of Section 3</Heading>In Section 3 of the principle act, for the words "proceeds of crime and projecting", the word "proceeds of crime including its concealment, possession, acquisition or use and projecting or claiming"<NewPara/></Section><Section><Number>3</Number><Heading> Amendment of section 5</Heading>In section 5 of the principal Act, for sub-section (1), the following sub-section shall be substituted, namely:-<NewPara/>"(1) Where the Director or any other officer not below the rank of Deputy Director authorised by the Director for the purposes of this section, has reason to believe (the reason for such belief to be recorded in writing), on the basis of material in his possession, that- <NewPara/>
(a)	any person is in possession of any proceeds of crime; and <NewPara/>(b)	such proceeds of crime are likely to be concealed, transferred or dealt with in any manner which may result in frustrating any proceedings relating to confiscation of such proceeds of crime under this Chapter, <NewPara/>he may, by order in writing, provisionally attach such property for a period not exceeding one hundred and eighty days from the date of the order, in such manner as may be prescribed: <NewPara/>
Provided that no such order of attachment shall be made unless, in relation to the scheduled offence, a report has been forwarded to a Magistrate under section 173 of the Code of Criminal Procedure, 1973, or a complaint has been filed by a person authorised to investigate the offence mentioned in that Schedule, before a Magistrate or court for taking cognizance of the scheduled offence, as the case may be, or a similar report or complaint has been made or filed under the corresponding law of any other country: <NewPara/>Provided further that, notwithstanding anything contained in clause (6), any property of any person may be attached under this section if the Director or any other officer not below the rank of Deputy Director authorised by him for the purposes of this section has reason to believe (the reasons for such belief to be recorded in writing), on the basis of material in his possession, that if such property involved in money- laundering is not attached immediately under this Chapter, the non-attachment of the property is likely to frustrate any proceeding under this Act.".<NewPara/></Section></Sections></Chapter></Chapters><FootNotes/><EditorsNote/><Laws><Law>Banking &amp; Finance</Law><Law>RBI</Law></Laws><Industries/><States><State>Center</State></States></Legislation>